{"type": "config", "constrained_file": "src/styles.css", "eval_command": "node autoresearch/eval.mjs", "metric": "ux_debt (lower is better)", "guard_metric": "controls/text/medianFont per screen vs guard_baseline.json + npm run build + design constitution", "guard_threshold": "no screen loses controls, <=3% text loss, no median font shrink", "min_delta": 0.05, "baseline": 734.05, "iterations_planned": 100, "note": "re-baselined after the .card.stack layout fix (728.05 -> 734.05: links now laid out as blocks, so more are counted as tap targets)", "note2": "min_delta 0.1 -> 0.05 at #19: smallest signal weight is 0.1, and the eval is deterministic"}
{"type":"result","iteration":1,"commit":"fd78b6d","score":230.05,"delta":"-504","guard_pass":true,"status":"keep","description":"Focus ring on links, summaries and role=button (3px accent outline)","timestamp":"2026-09-30T14:45:54.355Z"}
{"type": "result", "iteration": 1.5, "commit": null, "score": 227.05, "delta": "-3", "guard_pass": true, "status": "baseline", "description": "HARNESS FIX: label-vs-input hit box now uses the larger of the two (text inputs with label[for] were measured by the label). Re-baseline.", "timestamp": "2026-09-30T14:46:57Z"}
{"type":"result","iteration":2,"commit":"cd16f0c","score":210.05,"delta":"-17","guard_pass":true,"status":"keep","description":"Topbar links (← All productions / ← Home) get 44px inline-flex box","timestamp":"2026-09-30T14:48:04.181Z"}
{"type":"result","iteration":3,"commit":"9e3ceb3","score":195.05,"delta":"-15","guard_pass":true,"status":"keep","description":"Event-line map links get 44px inline-flex hit box","timestamp":"2026-09-30T14:48:58.096Z"}
{"type":"result","iteration":4,"commit":"64746e8","score":175.05,"delta":"-20","guard_pass":true,"status":"keep","description":"Plain-list and card-stack standalone links get 44px","timestamp":"2026-09-30T14:50:09.121Z"}
{"type":"result","iteration":5,"commit":"963797c","score":164.05,"delta":"-11","guard_pass":true,"status":"keep","description":"button.link min-width 2rem -> 44px (Edit, ✕)","timestamp":"2026-09-30T14:50:57.421Z"}
{"type":"result","iteration":6,"commit":"97b1b6f","score":146.05,"delta":"-18","guard_pass":true,"status":"keep","description":"Checkbox/radio wrapping labels become 44px flex rows","timestamp":"2026-09-30T14:51:52.015Z"}
{"type":"result","iteration":7,"commit":"fe20546","score":146.05,"delta":"+0","guard_pass":true,"status":"keep_visual","description":"Visual fix for #6: checkbox labels nowrap; member-row checkbox no longer stretched","timestamp":"2026-09-30T14:55:44.183Z"}
{"type":"result","iteration":8,"commit":"5cfe832","score":77.85,"delta":"-68.2","guard_pass":true,"status":"keep","description":"Tab bar gap 4px -> 8px","timestamp":"2026-09-30T14:57:16.139Z"}
{"type":"result","iteration":9,"commit":"df7f3c8","score":70.35,"delta":"-7.5","guard_pass":true,"status":"keep","description":"Calendar-link row gap 4px -> 8px","timestamp":"2026-09-30T14:57:58.291Z"}
{"type":"result","iteration":10,"commit":"2b40a6e","score":58.35,"delta":"-12","guard_pass":true,"status":"keep","description":"Edit-table cell padding 0.2rem -> 0.25rem (8px between stacked inputs)","timestamp":"2026-09-30T14:58:58.319Z"}
{"type":"result","iteration":11,"commit":"7f6f499","score":57.35,"delta":"-1","guard_pass":true,"status":"keep","description":"Space between a textarea and the button row under it","timestamp":"2026-09-30T14:59:48.955Z"}
{"type":"result","iteration":12,"commit":"603b0b8","score":29.75,"delta":"-27.6","guard_pass":true,"status":"keep","description":"--muted #6b6478 -> #544e63 (5.1:1 -> 7.15:1, AAA on paper and white)","timestamp":"2026-09-30T15:01:35.785Z"}
{"type":"result","iteration":13,"commit":"9de6d6c","score":23.5,"delta":"-6.25","guard_pass":true,"status":"keep","description":"Pills 0.8rem -> 0.85rem (13.6px -> 14.45px)","timestamp":"2026-09-30T15:02:26.321Z"}
{"type":"result","iteration":14,"commit":"20f9668","score":23,"delta":"-0.5","guard_pass":true,"status":"keep","description":"Chat author line 0.8rem -> 0.85rem","timestamp":"2026-09-30T15:03:07.265Z"}
{"type":"result","iteration":15,"commit":"9dc580d","score":20,"delta":"-3","guard_pass":true,"status":"keep","description":"member-row selects/inputs min-width 9rem -> 11rem so role names fit","timestamp":"2026-09-30T15:04:03.607Z"}
{"type":"result","iteration":16,"commit":null,"score":20,"delta":"+0","guard_pass":true,"status":"discard","description":"Input side padding 0.75rem -> 0.65rem","timestamp":"2026-09-30T15:04:50.490Z"}
{"type": "result", "iteration": 16.5, "commit": null, "score": 136.35, "delta": null, "guard_pass": true, "status": "baseline", "description": "HARNESS WIDENED (round 1b): +17 screens (community, audition form, print, check-in, packet, bios, operator, roll call, timeline editor, 6x 320px) + forced-colors borderless buttons (0.5) + WCAG 1.4.12 text-spacing clipping (1) / overflow (10). Re-baseline.", "timestamp": "2026-09-30T15:09:39Z"}
{"type":"result","iteration":17,"commit":null,"score":68.85,"delta":"+48.85","guard_pass":true,"status":"discard","description":"Forced-colors: borderless buttons get a ButtonText border","timestamp":"2026-09-30T15:10:53.562Z"}
{"type":"result","iteration":18,"commit":"cb5c2a7","score":68.85,"delta":"-67.5","guard_pass":true,"status":"keep","description":"Forced-colors: borderless buttons get a ButtonText border","timestamp":"2026-09-30T15:12:23.067Z"}
{"type":"result","iteration":19,"commit":null,"score":68.75,"delta":"-0.1","guard_pass":true,"status":"discard","description":"--error #b3372f -> #962c25 (5.4:1 -> 7.05:1)","timestamp":"2026-09-30T15:14:03.959Z"}
{"type":"result","iteration":20,"commit":"6f26907","score":68.75,"delta":"-0.1","guard_pass":true,"status":"keep","description":"--error #b3372f -> #962c25 (5.4:1 -> 7.05:1), retry after min-delta fix","timestamp":"2026-09-30T15:15:26.457Z"}
{"type":"result","iteration":21,"commit":"6139347","score":67.75,"delta":"-1","guard_pass":true,"status":"keep","description":"Paragraph-only links (check-in '→ Tonight's schedule') get 44px","timestamp":"2026-09-30T15:16:45.262Z"}
{"type":"result","iteration":22,"commit":"c653033","score":65.75,"delta":"-2","guard_pass":true,"status":"keep","description":"Focus ring also on input:focus-within (date/time inner fields)","timestamp":"2026-09-30T15:18:28.059Z"}
{"type":"result","iteration":23,"commit":"762b3cf","score":61.75,"delta":"-4","guard_pass":true,"status":"keep","description":"Month grid cells wrap (overflow-wrap:anywhere) instead of clipping","timestamp":"2026-09-30T15:19:52.361Z"}
{"type":"result","iteration":24,"commit":"478dfb4","score":51,"delta":"-10.75","guard_pass":true,"status":"keep","description":"Month grid 0.72rem -> 0.85rem on screen (print keeps 0.72rem)","timestamp":"2026-09-30T15:21:13.902Z"}
{"type":"result","iteration":25,"commit":"4a98d7a","score":51,"delta":"+0","guard_pass":true,"status":"keep_visual","description":"hyphens:auto on month-grid + contact-sheet cells (no mid-word splits on real phones)","timestamp":"2026-09-30T15:23:41.605Z"}
{"type":"result","iteration":26,"commit":null,"score":54,"delta":"+3","guard_pass":true,"status":"discard","description":"Row labels/inputs flex-basis 10rem so fields wrap instead of squeezing","timestamp":"2026-09-30T15:25:53.038Z"}
{"type":"result","iteration":27,"commit":"f0f8951","score":50,"delta":"-1","guard_pass":true,"status":"keep","description":"Row labels flex-basis 10rem (labels only) so fields wrap instead of squeezing","timestamp":"2026-09-30T15:27:12.212Z"}
{"type":"result","iteration":28,"commit":null,"score":95,"delta":"+45","guard_pass":true,"status":"discard","description":"Text field + button rows: field flex 1 1 15rem, button wraps under on phones","timestamp":"2026-09-30T15:28:27.778Z"}
{"type":"result","iteration":29,"commit":null,"score":50,"delta":"+0","guard_pass":true,"status":"discard","description":"Phone: single field+button rows give the field the full line","timestamp":"2026-09-30T15:29:39.776Z"}
{"type":"result","iteration":30,"commit":"6e24520","score":38,"delta":"-12","guard_pass":true,"status":"keep","description":"Casting-notes fields become 2-row textareas so the example is readable","timestamp":"2026-09-30T15:31:26.552Z"}
{"type":"result","iteration":31,"commit":"50677c1","score":35,"delta":"-3","guard_pass":true,"status":"keep","description":"Event-types list becomes a 2-row textarea (whole standard list visible)","timestamp":"2026-09-30T15:32:55.095Z"}
{"type":"result","iteration":32,"commit":"f34a2b4","score":33,"delta":"-2","guard_pass":true,"status":"keep","description":"Playwright/composer credit becomes a 2-row textarea (long credits fit)","timestamp":"2026-09-30T15:34:05.696Z"}
{"type":"result","iteration":33,"commit":"ac8bae8","score":27,"delta":"-6","guard_pass":true,"status":"keep","description":"Operator ticket-link placeholder shortened to fit (aria-label names the company)","timestamp":"2026-09-30T15:35:37.840Z"}
{"type":"result","iteration":34,"commit":"8748e72","score":25,"delta":"-2","guard_pass":true,"status":"keep","description":"Production ticket-link placeholder shortened to fit phones","timestamp":"2026-09-30T15:36:48.659Z"}
{"type":"result","iteration":35,"commit":"4ba7e06","score":23,"delta":"-2","guard_pass":true,"status":"keep","description":"Sign-in name placeholder: 'First and last name' (fits phones)","timestamp":"2026-09-30T15:38:46.174Z"}
{"type":"result","iteration":36,"commit":"9e02795","score":22,"delta":"-1","guard_pass":true,"status":"keep","description":"Sign-in code placeholder shortened","timestamp":"2026-09-30T15:39:55.956Z"}
{"type":"result","iteration":37,"commit":"24019da","score":17,"delta":"-5","guard_pass":true,"status":"keep","description":"Conflict reason placeholder shortened to fit","timestamp":"2026-09-30T15:41:04.683Z"}
{"type":"result","iteration":38,"commit":"67e9c15","score":17,"delta":"+0","guard_pass":true,"status":"keep_visual","description":"Conflict reason placeholder back on the 'for example:' convention","timestamp":"2026-09-30T15:42:32.876Z"}
{"type":"result","iteration":39,"commit":"ad45b8b","score":15,"delta":"-2","guard_pass":true,"status":"keep","description":"To-do placeholder shortened to fit","timestamp":"2026-09-30T15:43:42.652Z"}
{"type":"result","iteration":40,"commit":"25e503d","score":14,"delta":"-1","guard_pass":true,"status":"keep","description":"Home join-code placeholder shortened","timestamp":"2026-09-30T15:44:51.396Z"}
{"type":"result","iteration":41,"commit":"896ac5c","score":12,"delta":"-2","guard_pass":true,"status":"keep","description":"Add-role placeholder shortened","timestamp":"2026-09-30T15:46:00.147Z"}
{"type":"result","iteration":42,"commit":"e486c39","score":11,"delta":"-1","guard_pass":true,"status":"keep","description":"Busy-hours label placeholder shortened","timestamp":"2026-09-30T15:47:18.360Z"}
{"type":"result","iteration":43,"commit":"b5eae62","score":10,"delta":"-1","guard_pass":true,"status":"keep","description":"Event title placeholder shortened","timestamp":"2026-09-30T15:48:27.320Z"}
{"type":"result","iteration":44,"commit":"95a6268","score":9,"delta":"-1","guard_pass":true,"status":"keep","description":"Resource title placeholder shortened","timestamp":"2026-09-30T15:49:36.320Z"}
{"type":"result","iteration":45,"commit":null,"score":9,"delta":"+0","guard_pass":true,"status":"discard","description":"New-channel placeholder shortened","timestamp":"2026-09-30T15:50:39.237Z"}
{"type":"result","iteration":46,"commit":null,"score":9,"delta":"+0","guard_pass":true,"status":"discard","description":"New-channel placeholder: 'Channel — for example: Props'","timestamp":"2026-09-30T15:53:09.463Z"}
{"type":"result","iteration":47,"commit":"0c528b2","score":8,"delta":"-1","guard_pass":true,"status":"keep","description":"Profile skills placeholder shortened","timestamp":"2026-09-30T15:54:19.934Z"}
{"type":"result","iteration":48,"commit":"85bd9d0","score":7,"delta":"-1","guard_pass":true,"status":"keep","description":"Request-form dates placeholder shortened","timestamp":"2026-09-30T15:55:28.971Z"}
{"type":"result","iteration":49,"commit":"f395aed","score":6,"delta":"-1","guard_pass":true,"status":"keep","description":"Timeline template-name placeholder shortened","timestamp":"2026-09-30T15:56:37.796Z"}
{"type":"result","iteration":50,"commit":"be96e8e","score":5,"delta":"-1","guard_pass":true,"status":"keep","description":"New-channel placeholder: 'Channel — for example: Props'","timestamp":"2026-09-30T15:57:57.459Z"}
{"type":"result","iteration":51,"commit":"1e6df94","score":3,"delta":"-2","guard_pass":true,"status":"keep","description":"Audition form error state gets an h1 + role=alert","timestamp":"2026-09-30T15:59:44.246Z"}
{"type":"result","iteration":52,"commit":"81196c1","score":1,"delta":"-2","guard_pass":true,"status":"keep","description":"Row labels flex-basis 10rem -> 12rem (one field per line on phones)","timestamp":"2026-09-30T16:01:04.396Z"}
{"type": "result", "iteration": 52.5, "commit": null, "score": 25.5, "delta": null, "guard_pass": true, "status": "baseline", "description": "HARNESS ROUND 3: richer seed v2 (open auditions + a signup, breakdown units, tracker rows, fitting slots, cast-party bring list, a timeline, a conflict, chat reactions, a profile). Re-baseline + new guard baseline.", "timestamp": "2026-09-30T16:04:51Z"}
{"type":"result","iteration":53,"commit":"1402cd8","score":5.5,"delta":"-20","guard_pass":true,"status":"keep","description":"Taken slot chips: dashed + muted (7:1) instead of opacity 0.6","timestamp":"2026-09-30T16:06:28.916Z"}
{"type":"result","iteration":54,"commit":"d72324d","score":2.5,"delta":"-3","guard_pass":true,"status":"keep","description":"Reaction chips gap 5px -> 8px","timestamp":"2026-09-30T16:07:51.392Z"}
{"type":"result","iteration":55,"commit":"46d2af5","score":2,"delta":"-0.5","guard_pass":true,"status":"keep","description":"--ok #256843 -> #205d3b (6.7:1 -> 7.8:1 on white)","timestamp":"2026-09-30T16:09:10.961Z"}
{"type": "result", "iteration": 55.5, "commit": null, "score": 6, "delta": null, "guard_pass": true, "status": "baseline", "description": "HARNESS ROUND 4: +11 screens (script room x3 with a generated PDF, show-report form, new sign-up sheet form, door poster, printable audition form, 4x tablet 768px). Re-baseline.", "timestamp": "2026-09-30T16:13:27Z"}
{"type":"result","iteration":56,"commit":"d8001a3","score":4,"delta":"-2","guard_pass":true,"status":"keep","description":"Sibling control rows directly inside a section get 0.5rem between them","timestamp":"2026-09-30T16:15:20.953Z"}
{"type":"result","iteration":57,"commit":"d8ea2c0","score":3,"delta":"-1","guard_pass":true,"status":"keep","description":"Show report audience field: drop fixed 6rem width (fills its label)","timestamp":"2026-09-30T16:17:09.902Z"}
{"type":"result","iteration":58,"commit":"3362ebb","score":2,"delta":"-1","guard_pass":true,"status":"keep","description":"Sign-up sheet location placeholder shortened","timestamp":"2026-09-30T16:18:41.391Z"}
{"type":"result","iteration":59,"commit":"8e45713","score":2,"delta":"+0","guard_pass":true,"status":"keep_visual","description":"Typed text in fields is normal weight (was inheriting bold from wrapping labels)","timestamp":"2026-09-30T16:20:57.799Z"}
{"type":"result","iteration":60,"commit":"59d9a85","score":2,"delta":"+0","guard_pass":true,"status":"keep_visual","description":"Space between the Pinned pill and the announcement title","timestamp":"2026-09-30T16:22:42.572Z"}
{"type":"result","iteration":61,"commit":"b57522d","score":2,"delta":"+0","guard_pass":true,"status":"keep_visual","description":"44px list-link rule scoped to link-only lists (.link-list); pills never wrap","timestamp":"2026-09-30T16:24:48.461Z"}
{"type":"result","iteration":62,"commit":"2d5fe2c","score":2,"delta":"+0","guard_pass":true,"status":"keep_visual","description":"Setup checklist: status box stays beside the step text","timestamp":"2026-09-30T16:27:01.431Z"}
{"type": "result", "iteration": 62.5, "commit": null, "score": 67, "delta": null, "guard_pass": true, "status": "baseline", "description": "HARNESS: + active-tab-offscreen check (5/screen) — found by eyeballing: on phones (and desktop Manage) the current tab starts scrolled out of the tab strip. Screenshots now captured before the focus/text-spacing probes. Re-baseline.", "timestamp": "2026-09-30T16:29:26Z"}
{"type":"result","iteration":63,"commit":"82e0482","score":2,"delta":"-65","guard_pass":true,"status":"keep","description":"Active tab scrolls into view in the tab strip on load/navigation","timestamp":"2026-09-30T16:31:24.240Z"}
{"type": "result", "iteration": 63.5, "commit": null, "score": 2, "delta": null, "guard_pass": true, "status": "baseline", "description": "HARNESS: seed v4 turns on door check-in so the check-in page and poster render their real content. Guard baseline rewritten; score unchanged.", "timestamp": "2026-09-30T16:34:45Z"}
{"type": "result", "iteration": 64.5, "commit": null, "score": 2, "delta": null, "guard_pass": true, "status": "baseline", "description": "HARNESS: browser clock frozen at 2026-09-30 (real date reached the seeded event dates and surfaced today-only UI). That drift exposed two real issues, fixed outside the loop: cancelled/not-called event cards faded with opacity (AA contrast fail) and event-card rows 2px apart; also --warn 6.6:1 -> 7.1:1. Score 134.6 (drifted) -> 2.", "timestamp": "2026-10-05T19:46:39Z"}
